{
  "$schema": "http://json-schema.org/draft-07/schema#",
  "title": "Loops UI config",
  "type": "object",
  "required": ["vault", "stakeholder", "self", "priorityCaps"],
  "properties": {
    "vault": {
      "type": "object",
      "properties": {
        "scanFolders": {
          "type": "array",
          "items": { "type": "string" },
          "description": "Folders at the vault root to scan for `- [ ]` checkbox loops."
        },
        "inboxFile": { "type": "string", "description": "Path (relative to vault root) where manual loops get appended." },
        "adoptedFile": { "type": "string" },
        "closeOutsFile": { "type": "string" }
      }
    },
    "stakeholder": {
      "type": "object",
      "description": "The primary stakeholder. Drives the P1 capacity bucket, the weekly summary, and the pLevel tag (e.g. `P1:Boss`).",
      "properties": {
        "name": { "type": "string", "description": "Display name shown in the UI. e.g. 'Boss', 'Manager', or a person's first name." },
        "tag": { "type": "string", "description": "Tag used in pLevel strings. Typically same as name, no spaces." },
        "capacityMax": { "type": "number", "description": "Max active P1:<tag> loops before the capacity gate fires." },
        "weeklySummary": { "type": "boolean", "description": "Whether to render the StakeholderUpdateCard (weekly draft)." },
        "staleDays": { "type": "number", "description": "Loops with this tag untouched for N days raise a flag on the weekly draft." }
      }
    },
    "self": {
      "type": "object",
      "properties": {
        "capacityMax": { "type": "number", "description": "Max active P1:self loops before the capacity gate fires." }
      }
    },
    "priorityCaps": {
      "type": "object",
      "properties": {
        "P1Flat": { "type": "number" },
        "P2Flat": { "type": "number" }
      }
    },
    "scannerStakeholders": {
      "type": "array",
      "description": "Additional names the vault scanner should detect in task text and tag as P3:<Name>. Lowercase keyword → display name.",
      "items": {
        "type": "object",
        "required": ["keyword", "name"],
        "properties": {
          "keyword": { "type": "string" },
          "name": { "type": "string" }
        }
      }
    },
    "subgroupHints": {
      "type": "array",
      "description": "Subgroup-name substring → work-mode hint for classification fallback.",
      "items": {
        "type": "object",
        "required": ["match", "mode"],
        "properties": {
          "match": { "type": "string" },
          "mode": { "enum": ["build", "design", "communicate", "research", "ops"] }
        }
      }
    },
    "repos": {
      "type": "array",
      "description": "Codebases you work in. Each entry surfaces in the ClaudeChat repo picker so you can run `claude -p` against the right tree instead of the vault.",
      "items": {
        "type": "object",
        "required": ["name", "path"],
        "properties": {
          "name": { "type": "string", "description": "Display name shown in the picker. e.g. 'frontend', 'api', 'infra'." },
          "path": { "type": "string", "description": "Absolute path to the repo on disk." }
        }
      }
    },
    "researchFolders": {
      "type": "array",
      "description": "Vault folders the Research shelf scans. When omitted, the app falls back to the public-template defaults. Override when your vault uses a different layout (e.g. artifacts under assets/, reports under 01-Building/).",
      "items": {
        "type": "object",
        "required": ["folder", "category", "recursive"],
        "properties": {
          "folder": { "type": "string", "description": "Vault-relative folder to scan." },
          "category": {
            "enum": ["strategic-research", "technical-investigation", "design-research", "foundational", "artifact"]
          },
          "recursive": { "type": "boolean" },
          "extensions": {
            "type": "array",
            "items": { "type": "string" },
            "description": "File extensions to include. Defaults to ['.md']; use ['.html'] for artifacts."
          }
        }
      }
    }
  }
}
